{
  "$schema": "https://json-schema.org/draft/2020-12/schema",
  "title": "Taxonomy Component",
  "type": "object",
  "additionalProperties": false,
  "required": [
    "component_id",
    "name",
    "source",
    "strauss_formulation",
    "mechanism",
    "documentary_function",
    "investigative_requirement",
    "reconstruction_status",
    "minimum_trigger_features",
    "ordinary_alternatives",
    "authorized_engine_action",
    "prohibited_inferences",
    "uncertainty_note"
  ],
  "properties": {
    "component_id": {
      "type": "string",
      "pattern": "^LC-[0-9]{3}$"
    },
    "name": {
      "type": "string",
      "minLength": 1
    },
    "source": {
      "type": "object"
    },
    "strauss_formulation": {
      "type": "string",
      "minLength": 1
    },
    "mechanism": {
      "type": "string",
      "minLength": 1
    },
    "documentary_function": {
      "type": "string",
      "minLength": 1
    },
    "investigative_requirement": {
      "type": "string",
      "minLength": 1
    },
    "examples": {
      "type": "array",
      "items": {
        "type": "string"
      }
    },
    "reconstruction_status": {
      "type": "string",
      "minLength": 1
    },
    "related_technique_ids": {
      "type": "array",
      "items": {
        "type": "string"
      }
    },
    "distinguished_from": {
      "type": "array",
      "items": {
        "type": "string"
      }
    },
    "minimum_trigger_features": {
      "type": "array",
      "minItems": 1,
      "items": {
        "type": "string"
      }
    },
    "required_corroboration_features": {
      "type": "array",
      "items": {
        "type": "string"
      }
    },
    "ordinary_alternatives": {
      "type": "array",
      "minItems": 1,
      "items": {
        "type": "string"
      }
    },
    "disqualifying_conditions": {
      "type": "array",
      "items": {
        "type": "string"
      }
    },
    "authorized_engine_action": {
      "type": "string",
      "minLength": 1
    },
    "prohibited_inferences": {
      "type": "array",
      "minItems": 1,
      "items": {
        "type": "string"
      }
    },
    "uncertainty_note": {
      "type": "string",
      "minLength": 1
    }
  }
}